{
  "schema_version": "1.0",
  "id": "fairy-fusion",
  "name": "Fairy Fusion Internal Review Adapter",
  "kind": "domain-tool",
  "source": {
    "upstream": "https://github.com/bonginkan/fairy_tale",
    "license": "Fairy Tale internal workflow contract",
    "notes": "Internal bounded multi-reviewer orchestration. OpenRouter Fusion, Subagent, Advisor, and agent-system design-space papers are used only as public design references; this adapter does not call OpenRouter."
  },
  "capabilities": [
    "local fusion-style deliberation contract",
    "structured consensus and contradiction synthesis",
    "blind-spot and partial-coverage review",
    "bounded specialist subagent fan-out",
    "bounded automatic trigger decisions for plugin-managed harnesses",
    "append-only sidechain review artifacts with compact synthesis return",
    "legal near-miss closure review"
  ],
  "entrypoints": {
    "import": "scripts/fairy_fusion_review.py",
    "construct": "scripts/fairy_fusion_review.py --domain legal --prompt-file <task.md>",
    "run": "scripts/fairy_fusion_review.py --domain legal --prompt-file <task.md> --execute --output <review.json>",
    "optional": [
      "fairy fusion --auto-check --state-json <state.json> --output <decision.json>",
      "scripts/fairy_fusion_review.py --task-json <task.json> --dry-run",
      "scripts/fairy_fusion_review.py --roles-file <roles.json> --execute",
      "scripts/swebench_pro_run.py codex-patches --fairy-fusion --fusion-auto --fusion-retry-on-stuck --fusion-max-retries 0",
      "scripts/legal_feedback_analyzer.py --retry-output <tasks.json>"
    ]
  },
  "contracts": {
    "inputs": [
      "task facts and files",
      "reviewer roles or domain defaults",
      "budget and fan-out cap",
      "required output schema",
      "allowed provider and tool boundary",
      "automatic trigger state when decision mode is used"
    ],
    "outputs": [
      "consensus points",
      "contradictions",
      "partial coverage",
      "unique insights",
      "blind spots",
      "final closure checklist",
      "decision-only trigger record when automatic check mode is used"
    ],
    "evidence": [
      "source docs checked date for design references",
      "reviewer role list",
      "executor model and judge model when executed",
      "reviewer outputs",
      "synthesis decision table",
      "cost and latency",
      "trigger reasons, reviewer cap, recursion depth and cap, artifact path, and input SHA-256"
    ]
  },
  "safety": {
    "boundaries": [
      "Use Fairy Fusion only when the cost of being wrong exceeds the cost of extra reviewer passes.",
      "Cap panel size and recursion depth before launching reviewers.",
      "Keep legal reviewers evidence-grounded and do not present outputs as legal advice.",
      "Do not send confidential matter files to external providers without explicit authorization.",
      "Label this as Fairy Fusion or fusion-style review, not OpenRouter Fusion.",
      "Keep each reviewer isolated: task context and output schema only, no parent conversation transcript.",
      "For automatic activation, trigger on repeated failure signatures, empty or meaningless artifacts, missing validation ledgers, review conflicts, or explicit requests rather than benchmark sample IDs.",
      "Automatic checks decide only; they do not launch reviewers, call providers, retry work, or exceed recursion depth 1."
    ],
    "forbidden_claims": [
      "Fusion guarantees correctness.",
      "A majority vote is sufficient for legal completeness.",
      "Fairy Fusion is the OpenRouter Fusion API.",
      "Fairy Fusion uses OpenRouter unless an integration explicitly says so.",
      "Advisor or subagent output can override benchmark evidence without validation."
    ]
  },
  "validation": {
    "checks": [
      "adapter manifest validates against schemas/fairy-tale-adapter.schema.json",
      "source documentation checked date is recorded",
      "reviewer fan-out cap is set",
      "automatic trigger threshold is explicit",
      "automatic decision conforms to schemas/fairy-fusion-trigger-decision.schema.json",
      "automatic_execution is false and recursion_cap is 1",
      "runner compiles with python3 -m py_compile",
      "synthesis includes contradictions and blind spots",
      "benchmark retry records before/after scores"
    ],
    "minimum_artifacts": [
      "adapter manifest",
      "source links",
      "execution mode: reviewer outputs and synthesis table",
      "automatic decision mode: validated state and trigger decision",
      "retry result summary when a retrying integration is explicitly enabled"
    ]
  }
}
