{
  "schema_version": "1.0",
  "id": "exploitbench",
  "name": "ExploitBench V8 Runner",
  "kind": "evaluation-harness",
  "source": {
    "upstream": "https://github.com/exploitbench/exploitbench",
    "package": "exploitbench",
    "local_path_hint": "tmp/exploitbench",
    "license": "MIT",
    "notes": "Official public ExploitBench repository checked on 2026-06-14 JST. HEAD observed at 11569a070683f4eb304563f919fdaee0cc17e0cf. The public leaderboard reports V8 capability-ladder results and the upstream CLI drives direct provider APIs or OpenAI-compatible gateways against containerized MCP environments."
  },
  "capabilities": [
    "ExploitBench doctor and mock smoke execution",
    "single-cell V8 benchmark runs with explicit real-run confirmation",
    "Codex CLI plan capture for the upstream vendor-agent baseline scripts",
    "capability-ladder aggregate collection from the official CLI",
    "Fairy Tale provenance records around model, env, seed, turn budget, cost cap, and source commit"
  ],
  "entrypoints": {
    "import": "python scripts/exploitbench_run.py --help",
    "construct": "python scripts/exploitbench_run.py install",
    "run": "python scripts/exploitbench_run.py benchmark --dry-run",
    "optional": [
      "python scripts/exploitbench_run.py ensure-repo",
      "python scripts/exploitbench_run.py install",
      "python scripts/exploitbench_run.py doctor",
      "python scripts/exploitbench_run.py smoke --mock-llm",
      "python scripts/exploitbench_run.py benchmark --models openai/gpt-5.5 --envs v8-cve-2024-1939 --seeds 1 --turn-budget 20 --cost-cap-usd 2 --dry-run",
      "python scripts/exploitbench_run.py codex-plan",
      "python scripts/exploitbench_run.py aggregate --benchmark-id v8"
    ]
  },
  "contracts": {
    "inputs": [
      "ExploitBench upstream checkout",
      "isolated Python virtual environment",
      "model ids and provider API key presence",
      "V8 env ids and seeds",
      "turn budget, cost cap, max parallelism, and nudge policy",
      "explicit confirmation for real benchmark spend"
    ],
    "outputs": [
      "doctor, smoke, benchmark, aggregate, or codex-plan manifests",
      "official ExploitBench run artifacts under the upstream repo",
      "capability-ladder aggregate output",
      "cost, latency, turn, and failure metadata from the official runner"
    ],
    "evidence": [
      "ExploitBench upstream URL and commit",
      "official config path",
      "model/env/seed filters",
      "turn budget and cost cap",
      "command line emitted by the Fairy Tale wrapper",
      "official CLI output and aggregate artifacts"
    ]
  },
  "safety": {
    "boundaries": [
      "Use only official ExploitBench sandbox environments and the official CLI.",
      "Do not adapt benchmark artifacts into real-world exploitation instructions.",
      "Do not run reinforcement learning or tune on ExploitBench feedback because upstream warns it can pollute results.",
      "Do not launch real spend or long-running exploit-ladder episodes without explicit confirmation and a cost cap.",
      "Keep provider secret values out of manifests and logs."
    ],
    "forbidden_claims": [
      "A mock smoke is an ExploitBench score.",
      "A single V8 cell is a full ExploitBench leaderboard result.",
      "Fairy Tale bypasses model safeguards or changes model weights.",
      "ExploitBench capability output is a recommendation to exploit real systems."
    ]
  },
  "validation": {
    "checks": [
      "adapter manifest validates against schemas/fairy-tale-adapter.schema.json",
      "upstream repository is reachable",
      "wrapper help runs",
      "doctor command records a manifest",
      "mock smoke command records a manifest without real API spend",
      "real benchmark command refuses execution unless --confirm-real-run is present"
    ],
    "minimum_artifacts": [
      "source commit",
      "wrapper manifest",
      "official config path",
      "model/env/seed filters",
      "cost cap",
      "aggregate output for scored runs"
    ]
  }
}
