{
  "schema_version": "1.0",
  "id": "swe-bench-pro",
  "name": "SWE-Bench Pro Public Runner",
  "kind": "evaluation-harness",
  "source": {
    "upstream": "https://github.com/scaleapi/SWE-bench_Pro-os",
    "package": "ScaleAI/SWE-bench_Pro",
    "local_path_hint": "tmp/swe-bench-pro-os",
    "license": "MIT",
    "notes": "Public long-horizon software-engineering benchmark. Use the public dataset and OS harness for runnable agentic-coding evaluation. HF metadata checked on 2026-06-14 JST: public, ungated, revision 7ab5114912baf22bb098818e604c02fe7ad2c11f. OS repo shallow clone checked at ca10a60a5fcae51e6948ffe1485d4153d421e6c5."
  },
  "capabilities": [
    "SWE-Bench Pro public dataset loading",
    "Docker or Modal-based reproducible evaluation",
    "patch generation with SWE-agent or Codex CLI as the external coding-agent harness",
    "fail-to-pass and pass-to-pass test evaluation",
    "Fairy Tale maintainability and evidence gates around the same model",
    "Fairy Fusion preflight and stuck-trigger sidechain review for coding tasks"
  ],
  "entrypoints": {
    "import": "from datasets import load_dataset",
    "construct": "load_dataset('ScaleAI/SWE-bench_Pro', split='test')",
    "run": "python swe_bench_pro_eval.py --help",
    "optional": [
      "gh repo view scaleapi/SWE-bench_Pro-os",
      "git clone https://github.com/scaleapi/SWE-bench_Pro-os tmp/swe-bench-pro-os",
      "scripts/swebench_pro_prepare.py --sample-size 1 --output-dir tmp/swe-bench-pro-runs/prepared-smoke",
      "scripts/swebench_pro_run.py sweagent-instances --prepared-manifest tmp/swe-bench-pro-runs/prepared-smoke/manifest.json --output tmp/swe-bench-pro-os/SWE-agent/data/fairy-smoke.yaml",
      "scripts/swebench_pro_run.py sweagent-config --instances-path data/fairy-smoke.yaml --instances-slice :1 --output tmp/swe-bench-pro-os/SWE-agent/config/fairy_tale_swebench_pro.yaml",
      "scripts/swebench_pro_run.py --python tmp/swe-agent-venv/bin/python sweagent-compat",
      "scripts/swebench_pro_run.py plan --prepared-manifest tmp/swe-bench-pro-runs/prepared-smoke/manifest.json",
      "scripts/swebench_pro_run.py codex-patches --prepared-manifest tmp/swe-bench-pro-runs/prepared-smoke/manifest.json --dry-run",
      "scripts/swebench_pro_run.py codex-patches --prepared-manifest tmp/swe-bench-pro-runs/prepared-smoke/manifest.json --fairy-fusion --fusion-auto --fusion-retry-on-stuck --fusion-max-retries 0 --dry-run",
      "scripts/swebench_pro_run.py gather --pred-dir tmp/swe-bench-pro-runs/predictions --prefix gpt-5.5-fairy-tale-codex --dry-run",
      "scripts/swebench_pro_run.py eval --prepared-manifest tmp/swe-bench-pro-runs/prepared-smoke/manifest.json --patch-path tmp/swe-bench-pro-runs/current/patches.json --use-local-docker --dry-run",
      "python helper_code/gather_patches.py --help",
      "python - <<'PY'\nfrom datasets import load_dataset\nprint(load_dataset('ScaleAI/SWE-bench_Pro', split='test')[:1])\nPY"
    ]
  },
  "contracts": {
    "inputs": [
      "SWE-Bench Pro instance ids",
      "base model and reasoning effort",
      "condition: measured GPT-5.5 baseline or GPT-5.5 + Fairy Tale",
      "agent harness configuration",
      "Docker or Modal execution backend"
    ],
    "outputs": [
      "patch prediction artifact",
      "prompt-safe agent task artifact",
      "raw evaluator CSV artifact",
      "per-instance evaluation log",
      "pass/fail resolution score",
      "fail-to-pass and pass-to-pass test outcomes",
      "cost, token, latency, and retry summary"
    ],
    "evidence": [
      "dataset source and revision",
      "SWE-Bench Pro OS commit",
      "instance ids and docker image tags",
      "agent prompt and Fairy Tale skill revision",
      "Fairy Fusion task, review, and compact hint artifacts when enabled",
      "evaluation command and backend",
      "raw logs and summary JSON"
    ]
  },
  "safety": {
    "boundaries": [
      "Do not report a local subset as the official SWE-Bench Pro score.",
      "Do not compare runs unless sample ids, model, effort, scorer, retry policy, and tool budget match.",
      "Keep benchmark repositories and generated patches under ignored tmp paths unless curating an explicit artifact.",
      "Separate known Fable/Mythos and GPT-5.5 leaderboard data from local measured data."
    ],
    "forbidden_claims": [
      "This smoke slice proves a leaderboard-level SWE-Bench Pro result.",
      "A FrontierCode-style rubric is a FrontierCode benchmark score.",
      "The Fairy Tale process changed the base model weights.",
      "Unverified generated patches are production-ready."
    ]
  },
  "validation": {
    "checks": [
      "adapter manifest validates against schemas/fairy-tale-adapter.schema.json",
      "upstream repository is reachable",
      "dataset access is confirmed through Hugging Face",
      "one selected instance can be materialized with its dockerhub_tag",
      "prompt-safe agent tasks exclude gold patch, test patch, fail/pass scorer fields, and setup commands",
      "SWE-agent instance/config generation records reproducible manifests",
      "SWE-agent compatibility patch handles top_p null, newly named model cost accounting, and empty python_standalone_dir",
      "Codex CLI patch-generation runner records worktree, container, model, effort, sandbox, and patch artifacts",
      "Fairy Fusion run records reviewer cap, trigger reason, sidechain review JSON, and compact hint when enabled",
      "one dry-run patch-generation task records prompt, model, effort, and artifact paths before scoring",
      "runner wrapper records gather and eval manifests before executing official scorer"
    ],
    "minimum_artifacts": [
      "manifest",
      "source commit",
      "sample ids",
      "agent configuration",
      "prediction artifact",
      "evaluation summary"
    ]
  }
}
